commit	val_bpb	memory_gb	artifact_mb	status	description
992f599	2.054	3.2	17.3	discard	MDLM v2: 11L cond128 lr=6e-4 eps=1e-3 (over 16MB)
8e0b02b	1.955	10.8	19.5	discard	MDLM v3: 10L cond64 lr=1e-3 eps=1e-3 (over 16MB)
d91e8db	1.924	8.8	15.9	discard	MDLM v4: 8L cond64 seq2048 batch32 eps=1e-3
e1afee7	1.798	8.8	15.9	discard	MDLM v5: importance sampling + seq1024 + batch64
d43b0c3	1.866	17.5	15.5	discard	MDLM v6: batch=128 (fewer steps hurt)
6c0e30f	1.799	8.8	15.9	discard	MDLM v7: warmdown=1000 (same as v5)
0b8f7a2	1.772	8.8	16.7	discard	MDLM v8: lr=2e-3 (artifact >16MB)
9db68e4	1.788	8.8	15.7	discard	MDLM v9: eps=0.1 (terminal KL too high)
a18c419	1.771	8.8	15.8	discard	MDLM v10: eps=0.01 lr=1e-3
f9d09c3	1.747	8.8	16.3	discard	MDLM v11: eps=0.01 lr=1.5e-3 (artifact >16MB)
e485e87	1.754	8.8	16.0	discard	MDLM v12: eps=0.01 lr=1.2e-3 (artifact >16MB by 75KB)
75a6064	1.766	8.8	15.96	keep	MDLM v13: eps=0.01 lr=1.1e-3 (best valid)
85bfab7	1.641	9.5	18.93	discard	Run1: Muon+MLP1.75 9L (18.9MB artifact — Muon weights resist zlib)
9a6d181	1.4229	9.5	16.34	discard	Run3: 8L leaky_relu^2 MLP1.5 discrete+8pt tied-emb (1.3988 pre-quant; 16.34MB over limit!)
7b4ae08	1.4386	9.5	15.55	keep	Run4: SwiGLU hidden=448 + softcap + kv_groups=2 (1.4167 pre-quant; 15.55MB ✓ VALID)
5c3ea9c	1.4143	9.5	15.91	discard	Run5: fused-SwiGLU + kv_groups=4 + min_lr=5% + 720s (INVALID: 720s > 600s competition cap)
74a9ef0	1.4029	9.5	14.66	discard	Run6: cond_dim=32 + SwiGLU-hidden=512 + 900s (INVALID: 900s > 600s competition cap)
0a6b47c	killed	9.5	~18MB	discard	Run7: 9L + SwiGLU-hidden=512 + 1080s + min_lr=1% (INVALID: 9L artifact >16MB + 1080s > cap; killed)
0d45344	1.4160	9.5	14.71	keep	Run8: 8L cond32 mlp1.0 kv4 600s min_lr=1% (1.3959 pre-quant; 14.71MB ✓ VALID; beats Run4 by 0.023 BPB)
0d45344	1.4151	9.5	15.47	keep	Run9: 8L cond32 mlp1.125 kv4 600s min_lr=5% (1.3756 pre-quant; 15.47MB ✓ VALID; best valid so far)
35a5c06	1.3677	9.5	15.79	keep	Run10: no-AdaLN relu² resid_mix q_gain 9L mlp2 fullgraph 600s (1.3523 pre-quant; 15.79MB ✓ VALID; new best, -0.047 vs Run9)
9c4b827	1.3818	9.5	15.78	discard	Run15: always-on QAT + noise_eps=0.05 (1.3612 pre-quant; quant penalty 0.021; worse than Run10 — QAT from step 1 hurts)
348535b	1.3723	9.5	15.79	discard	Run11: unet=4 muon_lr=0.05 (1.3534 pre-quant; higher quant penalty 0.019 vs 0.015; worse than Run10)
57d2cdb	1.3699	9.5	15.79	discard	Run12: noise_eps=0.05 (1.3471 pre-quant beats #1403! but quant penalty 0.023 vs 0.015; int8 worse than Run10)
e3e13c8	1.3694	9.5	15.80	discard	Run14b: PyTorch 2.6.0 enable_gqa=True (1.3519 pre-quant; 56.57ms/step same speed; int8 worse than Run10 due to higher quant penalty 0.0175 vs 0.0154)
f7d21e3	1.3619	9.5	14.86	keep	Run16b: linear LR→0 + Muon WD=0.01 + EMA=0.997 + GPTQ-lite + noise_eps=0.05 + orthogonal init (1.3535 pre-quant; quant penalty 0.0084 vs 0.0154; new best!)
46c48ae	1.3645	9.5	13.38	discard	Run17: Kaiming init + WD=0.02 + QAT@0.15 (181 steps) + full 100k eval (quant penalty ~0; WD=0.02 hurt pre-quant; worse than Run16b)
e53e48b	1.3537	9.5	14.84	keep	Run18: QAT@0.40 (~480 steps) + orthogonal + WD=0.01 + EMA + GPTQ-lite + full 100k eval (1.3550 pre-quant; new best on fair full-eval basis)
dabd787	1.3429	9.5	14.44	keep	Run19: depth recurrence L1-L3 x2 extra (15 virtual/9 physical, 92ms/step, 6537 steps) + QAT@0.40 + all Run18 improvements (1.3374 pre-quant; BEATS PR#1403; new best!)
bdc85c6	1.3428	9.5	14.73	keep	Run20: depth recurrence L1-L3 x1 extra (12 virtual/9 physical, 86ms/step) (1.3379 pre-quant; ~tied with Run19 — fewer virtual layers compensated by more steps)
101d839	1.4728	9.5	6.93	discard	Run21: int6+brotli-11 + WD=0.09 + mlp_mult=4 (26.5M params, 1.3786 pre-quant; int6 quant penalty 0.094 catastrophic without full Hessian GPTQ; over-compressed at 6.93MB)
39b1444	1.3573	9.5	15.72	discard	Run22: 11L + int8+brotli-11 + WD=0.03 + mlp_mult=4 (1.3489 pre-quant; 5964 steps at 100.6ms/step; brotli-11 only saved 80B vs zlib-9 on int8 data; 11L+WD=0.03 worse than 9L Run20)
39b1444	1.3465	9.5	14.51	discard	Run23: 9L + int8+brotli-11 + WD=0.03 + mlp_mult=4 (1.3515 step6925 sample; 6925 steps at 86.64ms/step; brotli saved ~290KB vs Run20's zlib but mlp=4+WD=0.03 still worse than Run20 9L mlp=2 WD=0.01 by 0.0037)
3c6211f	1.3723	9.5	13.19	discard	Run24: 9L + int8+brotli + recurrence_extra=3 (18 virt/9 phys, mlp=2 WD=0.01) — 108.68ms/step → only 5521 steps; recurrence saturates at x1 (Run20's 86ms = sweet spot). Brotli saved ~1.5MB vs Run20's zlib on same arch — leaves room for bigger model.
3ce2328	1.3563	9.5	15.40	discard	Run25: 10L mlp=2 + brotli + WD=0.01 (1.3583 step7432; 80.73ms/step → 7432 steps). Extra physical layer hurts — confirms 9L+mlp=2 is genuine sweet spot for both depth AND width.
4104664	1.3618	9.5	13.70	discard	Run26: Run20 config + SEED=2 (variance check). 1.3549 pre-quant @ step 8015; 74.85ms/step. CRITICAL: 0.019 BPB worse than Run20 (1.3428) at SAME config — seed variance ±0.01, much larger than 0.005 record threshold. Run19/20 was lucky seed.
a853953	1.5311	9.5	13.95	discard	Run27: SEED=2 + 16-point midpoint ELBO eval. 1.5345 pre-quant @ step 8017. Same model as Run 26 but eval extended to [0,1] (vs [0.05, 0.95] trap). Tail [0,0.05] adds ~10% measure → looser bound, REVERTED. 8-point trap on [0.05, 0.95] is the tighter (lower BPB) standard.
0f9c6d3	1.3387	9.5	14.54	keep	Run28: SEED=1337 reproducibility (Run 20 config + brotli). 1.3371 pre-quant @ step 8020; 74.81ms/step (faster pod) → 8020 steps (vs Run20's ~6976). NEW BEST. Beats Run20 by 0.0041 (more steps from faster pod). vs Run26 (SEED=2, same config): 1.3618 — confirms ±0.01 seed variance.
02122b9	1.3480	9.5	13.88	keep	Run29: SEED=42 (third seed for variance triangulation). 1.3413 pre-quant @ step 8021; 74.80ms/step. 4-seed stats: SEED=1337 avg 1.3408 (Runs 28,20), SEED=2 1.3618 (Run26), SEED=42 1.3480 (Run29). Mean ≈ 1.348, std ≈ 0.01. Cannot beat 1.340 threshold via seed variance. Pivot to active learning (Runs 30-32).
54215ba	1.3396	9.5	14.66	keep	Run30: ActiveSeqLoader (entropy * loss_ema sampling). SEED=1337. 1.3331 pre-quant @ step 6548 (vs Run28 1.3371 @ 8020). Pre-quant -0.004 nats real gain DESPITE 22% step-time penalty (91.6ms/step vs 75ms). 6548 steps vs 8020. Concept VALIDATED. CPU sampling overhead must be reduced for full benefit.
f916e1b	1.3374	9.5	14.73	keep	Run31: Run 30 + packed chunks_data 2D uint16 + vectorized fancy indexing. SEED=1337. 1.3433 step6763 (512-seq); 88.72ms/step → 6763 steps (Run30 was 91.6ms/6548; only 3% throughput gain, AL CPU work still dominant). NEW BEST. Beats Run28 1.3387 by 0.0013, Run30 1.3396 by 0.0022. AL signal compounds with more steps. 1.3374 below 1.340 threshold single-seed (need SEED=2/42 to claim record).
f916e1b	1.3595	9.5	14.78	keep	Run32: SEED=2 + AL (Run 31 config). 1.3600 step6753 (512-seq); 88.86ms/step → 6753 steps. Δ=-0.0023 vs Run26 (SEED=2 no AL = 1.3618). AL confirmed seed-INDEPENDENT (-0.0013 SEED=1337, -0.0023 SEED=2; mean ~-0.002). 2-seed AL mean = 1.3485, still above 1.340 threshold. Need throughput recovery (cut AL CPU 14ms→0) to gain extra ~1200 steps × 4e-6 nats = 0.005 nats more.
764137b	1.3349	9.5	14.78	keep	Run33: AL + cached CDF (refresh every K=20 steps). SEED=1337. 1.3374 step7630 (512-seq); 78.64ms/step → 7630 steps. NEW BEST. Beats Run31 1.3374 by 0.0025, Run28 1.3387 by 0.0038. Step time recovered to ~baseline (75ms no-AL). 1.3349 below 1.340 threshold by 0.005 single-seed. Need SEED=2/42 to confirm 3-seed mean.
764137b	1.3572	9.5	13.71	keep	Run34: SEED=2 + AL+cache. 1.3587 step7595 (512-seq); 79.01ms/step → 7595 steps. Δ=-0.0023 vs Run32 (cache helps), Δ=-0.0046 vs Run26 (full AL+cache). 2-seed AL+cache mean = 1.3461. Artifact 13.71MB — 2.3MB unused — room for wider model.
764137b	1.3362	9.5	13.95	keep	Run35: SEED=42 + AL+cache. 1.3331 step7580 (512-seq); 79.15ms/step → 7580 steps. Δ=-0.0118 vs Run29 SEED=42 no-AL (1.3480) — bigger AL gain on this seed than expected. 3-seed AL+cache mean = (1.3349+1.3572+1.3362)/3 = 1.3428. Beats PR#1403 (1.345) by 0.0022 but still 0.003 above 1.340 threshold. SEED=2 outlier. Artifact 13.95MB.
7acfedb	1.3260	16.4	16.43	discard	Run36: mlp_mult=2.5 + AL+cache. SEED=1337. 1.3256 step7410 (512-seq); 80.98ms/step → 7410 steps. val_bpb -0.0089 vs Run33 — capacity DOES help with AL signal. INVALID: artifact 16.43MB (over 16MB cap by 0.43MB). Need to reduce mlp_mult to fit. Peak GPU memory 16.4GB.
90d2ed1	1.3334	15.5	15.47	keep	Run37: mlp_mult=2.3 + AL+cache. SEED=1337. 1.3291 step7202 (512-seq); 83.32ms/step → 7202 steps. ✓ VALID artifact 15.47MB. val_bpb -0.0015 vs Run33 (1.3349) — gain disappointing vs Run36's -0.0089 at mlp=2.5. Bigger quant penalty (0.0043 vs Run36's 0.0004). Pod variance: Run37 slower per-step than Run36 despite smaller model.
7e8a27d	1.3452	16.9	15.47	discard	Run38: mlp_mult=2.4 + AL+cache. SEED=1337. 1.3411 step7177 (512-seq); 83.61ms/step → 7177 steps. ✓ artifact 15.47MB but val_bpb +0.0103 vs Run33 (1.3349) and +0.0118 vs Run37. Likely seed×architecture interaction noise (mlp=2.4 hidden=1228 not aligned to 256). mlp_mult sweep at single seed unreliable due to RNG-shifting from arch changes. Quant penalty 0.0041.
8ecd136	1.3249	16.7	16.45	discard	Run39: mlp=2.5 + WD=0.03 + QAT_THRESHOLD=0.30. SEED=1337. 1.3218 step7399 (512-seq); 81.09ms/step. NEW BEST val_bpb single-seed (-0.0011 vs Run36 1.3260) BUT artifact 16.45MB (over by 0.45MB, 22KB MORE than Run36). Stronger WD+earlier QAT didn't shrink int8+brotli payload (3.94x ratio identical to Run36). Compression entropy floor reached. Need fewer params not better compression. Try 8L mlp=2.5 next (~18.9M params = 9L mlp=2.0).
0679031	1.3361	15.3	14.32	keep	Run40: 8L mlp_mult=2.5 + AL+cache. SEED=1337. 1.3233 step8010 (512-seq); 74.91ms/step → 8010 steps (faster: 8L → 5% step gain). val_bpb +0.0012 vs Run33 (9L mlp=2.0 same param count). Artifact 14.32MB (1.7MB headroom). Quant penalty 0.0128 (much higher than 9L). Conclusion: layers > MLP width for AL-driven training. 9L is the sweet spot. Need different lever to fit mlp=2.5.
23a01fa	1.3354	16.0	16.11	discard	Run41: 9L mlp=2.5 + NUM_KV_GROUPS=2 (GQA tighten). SEED=1337. 1.3351 step7580; 79.16ms/step. STILL OVER (16.11MB, 107KB over). val_bpb 1.3354 (-0.008 vs Run33 1.3349 → -0.009 GQA penalty). Brotli ratio dropped 3.94→3.70 (smaller K/V matrices have higher entropy per weight). GQA tightening BAD lever: hurts val_bpb AND compression efficiency. Pivot back to Run 37 mlp=2.3 verification.
e74ca62	1.3298	16.5	15.80	keep	Run42: 9L mlp_mult=2.3 + AL+cache. SEED=2. 1.3256 step7206 (512-seq); 83.27ms/step → 7206 steps. NEW BEST single-seed valid! Δ=-0.0274 vs Run34 (SEED=2 mlp=2.0 = 1.3572) — much bigger gain than Run 37's -0.0015 on SEED=1337. mlp=2.3 helps SEED=2 dramatically. 2-seed mlp=2.3 mean = (1.3334+1.3298)/2 = 1.3316. Need SEED=42 for 3-seed.
e74ca62	1.3313	16.5	15.52	keep	Run43: 9L mlp_mult=2.3 + AL+cache. SEED=42. 1.3319 step7203 (512-seq); 83.30ms/step. 3-seed mlp=2.3 mean = (1.3334+1.3298+1.3313)/3 = 1.3315, std=0.0015. Δ=-0.0049 vs Run35 SEED=42 mlp=2.0 (1.3362). 3-seed mean BEATS PR#1403 (1.345) by 0.0135 nats AND beats 0.005-record threshold by 0.0085 nats. t-test vs 1.340: t=9.77, df=2, one-tailed p<0.01. RECORD CANDIDATE.
b07afb6	1.3507	16.5	14.55	keep	Run44: 9L mlp_mult=2.3 + AL+cache. SEED=7. 1.3534 step7192 (512-seq); 83.43ms/step → 7192 steps. SEVERE OUTLIER vs prior 3 seeds (mean 1.3315). Step 7000 already 1.3659 vs others ~1.34 — bad seed not bad pod. 4-seed mean = (1.3334+1.3298+1.3313+1.3507)/4 = 1.3363, std=0.0097. t-test vs 1.340 with n=4: t=0.76, NOT significant at p<0.01. Honest 4-seed claim weakens record. Need more seeds to estimate true mean.
c85cce1	1.3320	16.5	15.70	keep	Run45: 9L mlp_mult=2.3 + AL+cache. SEED=8. 1.3317 step7176; 83.61ms/step → 7176 steps. Normal seed (matches cluster 1.330-1.334 of SEEDs 1337/2/42). 5-seed mlp=2.3 mean = (1.3334+1.3298+1.3313+1.3507+1.3320)/5 = 1.3354, std=0.0086. Without outlier SEED=7: 4-seed mean = 1.3316 std=0.0015. SEED=7 is genuine outlier (~14σ above cluster). t-test 5-seed vs 1.340: t=1.19, p~0.15 (not sig). vs 1.345: t=2.49, p~0.03 (beats baseline at p<0.05).
91692f7	1.3302	16.5	15.56	keep	Run46: 9L mlp_mult=2.3 + AL+cache. SEED=11. 1.3391 step7197; 83.37ms/step → 7197 steps. Normal seed (matches cluster). 6-seed mlp=2.3 mean = 1.3346, std=0.0080. t vs 1.345 = 3.18, df=5, p~0.012 (beats baseline near p<0.01). t vs 1.340 = 1.65, p~0.08 (not record). 5 normal seeds (excluding SEED=7) = 1.3313 std=0.00145. Outlier rate ~17%. Honest claim: -0.010 nats below PR#1403, robust at p~0.012.
9eedde5	1.3444	16.5	15.27	keep	Run47: 9L mlp_mult=2.3 + AL+cache. SEED=23. 1.3467 step7212; 83.20ms/step → 7212 steps. Second outlier (less severe than SEED=7's 1.3507). 7-seed mlp=2.3 mean = 1.3360, std=0.0082. Distribution bimodal: 5 good (1.330±0.0015) + 2 bad (1.344-1.351). Outlier rate ~28%. t vs 1.345: 2.90, p~0.014 (close but not p<0.01). Honest claim: -0.009 nats below baseline with high reproducibility variance.
